"artistName","nationality","relatedArtWork","birthPlace","medium","accessionNumber","creditLine","deathDate","dateOfStartOfCreation","provenance","dimensions","deathPlace","classification","artWork","artworkTitle","dateOfEndOfCreation","birthDate"
"Barnett Newman","American","{'artistName': 'Barnett Newman', 'nationality': 'American', 'artworkTitle': 'The Station', 'birthPlace': 'New York', 'medium': 'Oil on canvas', 'creditLine': 'Gift of Longview Foundation, Inc., in memory of Audrey Stern Hess, 1975', 'accessionNumber': '1975.189.1', 'dateOfStartOfCreation': '1963', 'deathDate': '1970', 'provenance': 'MetDoesntKnow', 'dimensions': 'H. 24, W. 24-1 4 inches (61 x 61.6 cm.)', 'classification': 'Paintings', 'dateOfEndOfCreation': '1963', 'deathPlace': 'MetDoesntKnow', 'birthDate': '1905'}","New York","Oil and masking tape on canvas","68.178","George A. Hearn Fund, 1968","1970","1949","MetDoesntKnow","H. 89-3 4, W. 53-5 8 inches (228 x 136.2 cm.)","MetDoesntKnow","Paintings"," ","Concord","1949","1905"
"Maxwell Hendler","American","{'artistName': 'Maxwell Hendler', 'nationality': 'American', 'artworkTitle': 'Afternoon Television', 'birthPlace': 'MetDoesntKnow', 'medium': 'Oil on wood', 'creditLine': 'George A. Hearn Fund, 1977', 'accessionNumber': '1977.6', 'dateOfStartOfCreation': '1965', 'deathDate': 'MetDoesntKnow', 'provenance': 'MetDoesntKnow', 'dimensions': 'H. 10-3 8, W. 12 inches (26.4 x 30.5 cm.)', 'classification': 'Paintings', 'dateOfEndOfCreation': '1965', 'deathPlace': 'born St. Louis Missouri', 'birthDate': '1938'}","MetDoesntKnow","Oil on wood","1975.288","Gift of the artist, 1975","MetDoesntKnow","1965","MetDoesntKnow","H. 12, W. 24 inches (30.5 x 61.2 cm.)","born St. Louis Missouri","Paintings"," ","David","1965","1938"
"Richard Chiriani","American","{'artistName': 'Paul Dougherty', 'nationality': 'American', 'artworkTitle': 'October Seas', 'birthPlace': 'MetDoesntKnow', 'medium': 'Oil on canvas', 'creditLine': 'George A. Hearn Fund, 1911', 'accessionNumber': '11.77', 'dateOfStartOfCreation': '1910', 'deathDate': '1947', 'provenance': 'MetDoesntKnow', 'dimensions': 'H. 36-1 8, W. 48-1 8 inches (91.8 x 122.2 cm.)', 'classification': 'Paintings', 'dateOfEndOfCreation': '1910', 'deathPlace': 'MetDoesntKnow', 'birthDate': '1877'}","born","Alkyd on canvas mounted on composition board","1985.429","Gift of Dr. and Mrs. Robert E. Carroll, 1985","MetDoesntKnow","1979","MetDoesntKnow","H. 41-1 4, W. 107-1 8 inches (104.8 x 272.1 cm.)","MetDoesntKnow","Paintings"," ","Morning in the Cleveland Flats","1979","1942"
"George Fuller","American","{'artistName': 'George Fuller', 'nationality': 'American', 'artworkTitle': 'Nydia', 'birthPlace': 'Deerfield, Massachusetts', 'medium': 'Oil on canvas', 'creditLine': 'Gift of George I. Seney, 1887', 'accessionNumber': '87.8.10', 'dateOfStartOfCreation': '1882', 'deathDate': '1884', 'provenance': 'MetDoesntKnow', 'dimensions': '50 x 32 1 4 in. (127 x 81.9 cm)', 'classification': 'Paintings', 'dateOfEndOfCreation': '1882', 'deathPlace': 'Brookline Massachusetts', 'birthDate': '1822'}","Deerfield, Massachusetts","Oil on canvas","87.8.7","Gift of George I. Seney, 1887","1884","1877","MetDoesntKnow","30 x 40 in. (76.2 x 101.6 cm)","Brookline Massachusetts","Paintings"," ","And She Was a Witch","1884","1822"
"Marsden Hartley","American","{'artistName': 'Marsden Hartley', 'nationality': 'American', 'artworkTitle': 'Still Life No. 16', 'birthPlace': 'Lewiston, Maine', 'medium': 'Oil and charcoal on paperboard', 'creditLine': 'Alfred Stieglitz Collection, 1949', 'accessionNumber': '49.70.45', 'dateOfStartOfCreation': '1920 ', 'deathDate': '1943', 'provenance': 'MetDoesntKnow', 'dimensions': '27 x 19 in. (68.6 x 48.3 cm)', 'classification': 'Paintings', 'dateOfEndOfCreation': '1920 ', 'deathPlace': 'Ellsworth Maine', 'birthDate': '1877'}","Lewiston, Maine","Oil on cardboard","54.184.1","Anonymous Gift, in memory of Robert Glenn Price, 1954","1943","1910 ","MetDoesntKnow","H. 11-7 8, W. 14 inches (30.2 x 35.6 cm.)","Ellsworth Maine","Paintings"," ","Autumn Color","1910 ","1877"
"Conrad Marca-Relli","American","{'artistName': 'Conrad Marca-Relli', 'nationality': 'American', 'artworkTitle': 'Yellow Collage', 'birthPlace': 'MetDoesntKnow', 'medium': 'Collage of canvas on canvas', 'creditLine': 'Gift of Longview Foundation, Inc., in memory of Audrey Stern Hess, 1975', 'accessionNumber': '1975.189.2', 'dateOfStartOfCreation': '1960', 'deathDate': '2000', 'provenance': 'MetDoesntKnow', 'dimensions': 'H. 23, W. 26-1 8 inches (58.4 x 66.4 cm.)', 'classification': 'Paintings', 'dateOfEndOfCreation': '1960', 'deathPlace': 'MetDoesntKnow', 'birthDate': '1913'}","MetDoesntKnow","Painted canvas collage","1971.109","Gift of Edwin L. Weisl, Jr., 1971","2000","1955","MetDoesntKnow","H. 36-7 8, W. 46-5 8 inches (93.7 x 118.4 cm.)","MetDoesntKnow","Paintings"," ","Arras","1955","1913"
"Ford Crull","American","{'artistName': 'Ford Crull', 'nationality': 'American', 'artworkTitle': 'Open Series, Number 14', 'birthPlace': 'born', 'medium': 'Oil, oilstick, and graphite on paper', 'creditLine': 'Van Day Truex Fund, 1991', 'accessionNumber': '1991.12.2', 'dateOfStartOfCreation': '1989', 'deathDate': 'MetDoesntKnow', 'provenance': 'MetDoesntKnow', 'dimensions': 'H. 50, W. 38-3 4 inches (127 x 98.4 cm.)', 'classification': 'Drawings', 'dateOfEndOfCreation': '1989', 'deathPlace': 'MetDoesntKnow', 'birthDate': '1952'}","born","Oilstick, oil, and graphite on paper","1991.12.1","Van Day Truex Fund, 1991","MetDoesntKnow","1987","MetDoesntKnow","H. 30, W. 22-1 4 inches (76.2 x 56.5 cm.)","MetDoesntKnow","Drawings"," ","Cult Figure, Number 6","1988","1952"
"School of Sir Godrey Kneller 16461723","MetDoesntKnow","{'artistName': 'School of Sir Godrey Kneller 16461723', 'nationality': 'MetDoesntKnow', 'artworkTitle': 'Portrait of a Woman, Called Maria Taylor Byrd', 'birthPlace': 'MetDoesntKnow', 'medium': 'Oil on canvas', 'creditLine': 'Fletcher Fund, 1925', 'accessionNumber': '25.108', 'dateOfStartOfCreation': '1700', 'deathDate': '1723', 'provenance': 'possibly William Byrd II; possibly Mrs. William Byrd II; possibly William Byrd III; Maria Willing Byrd; Benjamin Harrison; Mrs. A. C. Bevan; G. P. Harrison; Mrs. Hugh Nelson Jr.; Ehrich Galleries, New York, 1925', 'dimensions': '49 1 2 x 40 in. (125.7 x 101.6 cm)', 'classification': 'Paintings', 'dateOfEndOfCreation': '1725', 'deathPlace': 'School of Sir Godrey Kneller', 'birthDate': '1646'}","MetDoesntKnow","Oil on canvas","54.196.1","Gift of The Chester Dale Collection, 1954","1723","1720 ","MetDoesntKnow","49 3 4 x 39 3 4 in. (125.2 x 99.8 cm)","School of Sir Godrey Kneller","Paintings"," ","Portrait of a Man","1730","1646"
"Louis Comfort Tiffany","American","{'artistName': 'Louis Comfort Tiffany', 'nationality': 'American', 'artworkTitle': 'Design for an underwater scene', 'birthPlace': 'New York', 'medium': 'Watercolor, gouache, colored pencil, metallic ink, and graphite on artist board', 'creditLine': 'The Elisha Whittelsey Collection, The Elisha Whittelsey Fund, 1953', 'accessionNumber': '53.679.1827', 'dateOfStartOfCreation': 'late19th', 'deathDate': '1933', 'provenance': 'MetDoesntKnow', 'dimensions': 'Dimensions unrecorded', 'classification': 'Drawings', 'dateOfEndOfCreation': 'early20thcentury', 'deathPlace': 'MetDoesntKnow', 'birthDate': '1848'}","New York","Watercolor, gouache, colored pencil, and graphite on board.","67.654.344","Purchase, Walter Hoving and Julia T. Weld Gifts and Dodge Fund, 1967","1933","late19th","MetDoesntKnow","Overall: 24 3 8 x 13 1 2 in. (61.9 x 34.3 cm)","MetDoesntKnow","Drawings"," ","Design for lantern","early20thcentury","1848"
"Charles Cromwell Ingham","MetDoesntKnow","{'artistName': 'Charles Cromwell Ingham', 'nationality': 'MetDoesntKnow', 'artworkTitle': 'Aunt Rhoda', 'birthPlace': 'MetDoesntKnow', 'medium': 'Watercolor on ivory in maroon leatherette case with ormolu mat', 'creditLine': 'Gift of Gloria Manney, 2006', 'accessionNumber': '2006.235.90', 'dateOfStartOfCreation': '1844', 'deathDate': '1863', 'provenance': 'MetDoesntKnow', 'dimensions': '4 1 8 x 3 1 8 in. (10.5 x 8 cm)', 'classification': 'Paintings', 'dateOfEndOfCreation': '1844', 'deathPlace': 'American born Ireland Dublin  New York', 'birthDate': '1786'}","MetDoesntKnow","Watercolor on ivory in maroon leatherette case with ormolu mat","2006.235.91","Gift of Gloria Manney, 2006","1863","1844","MetDoesntKnow","4 1 8 x 3 1 8 in. (10.5 x 8 cm)","American born Ireland Dublin  New York","Paintings"," ","Uncle Charles","1844","1786"
"Idelle Weber","American","{'artistName': 'Paul Dougherty', 'nationality': 'American', 'artworkTitle': 'October Seas', 'birthPlace': 'MetDoesntKnow', 'medium': 'Oil on canvas', 'creditLine': 'George A. Hearn Fund, 1911', 'accessionNumber': '11.77', 'dateOfStartOfCreation': '1910', 'deathDate': '1947', 'provenance': 'MetDoesntKnow', 'dimensions': 'H. 36-1 8, W. 48-1 8 inches (91.8 x 122.2 cm.)', 'classification': 'Paintings', 'dateOfEndOfCreation': '1910', 'deathPlace': 'MetDoesntKnow', 'birthDate': '1877'}","born","Oil on canvas","1991.175.7","Gift of Jane and Robert E. Carroll, 1991","MetDoesntKnow","1984","MetDoesntKnow","H. 43, W. 45-1 8 inches (149.2 x 114.6 cm.)","MetDoesntKnow","Paintings"," ","Villandry II","1984","1932"
"George Inness","American","{'artistName': 'George Inness', 'nationality': 'American', 'artworkTitle': 'Landscape', 'birthPlace': 'Newburgh, New York', 'medium': 'Oil on canvas', 'creditLine': 'Bequest of Miss Adelaide Milton de Groot (18761967), 1967', 'accessionNumber': '67.187.211', 'dateOfStartOfCreation': '1884or1889', 'deathDate': '1894', 'provenance': 'MetDoesntKnow', 'dimensions': '9 x 12 3 4 in. (22.9 x 31.2 cm)', 'classification': 'Paintings', 'dateOfEndOfCreation': '1884or1889', 'deathPlace': 'Bridge of Allan Scotland', 'birthDate': '1825'}","Newburgh, New York","Oil on canvas","94.27","Gift of George A. Hearn, 1894","1894","1865","MetDoesntKnow","77 5 8 x 112 3 8 in. (197.2 x 285.4 cm)","Bridge of Allan Scotland","Paintings"," ","Peace and Plenty","1865","1825"
"Thomas Hovenden","MetDoesntKnow","{'artistName': 'Thomas Hovenden', 'nationality': 'MetDoesntKnow', 'artworkTitle': 'Standing Woman', 'birthPlace': 'MetDoesntKnow', 'medium': 'Graphite and gouache watercolor on blue wove paper', 'creditLine': 'Rogers Fund, 1962', 'accessionNumber': '62.198.2', 'dateOfStartOfCreation': '1881 ', 'deathDate': '1895', 'provenance': 'MetDoesntKnow', 'dimensions': '11 3 4 x 8 1 2 in. (29.8 x 21.6 cm)', 'classification': 'Drawings', 'dateOfEndOfCreation': '1882', 'deathPlace': 'American born Ireland Dunmanway  Plymouth Meeting Pennsylvania', 'birthDate': '1840'}","MetDoesntKnow","Graphite and white gouache on blue wove paper","62.198.1","Rogers Fund, 1962","1895","null","MetDoesntKnow","13 1 8 x 9 1 2 in. (33.3 x 24.1 cm)","American born Ireland Dunmanway  Plymouth Meeting Pennsylvania","Drawings"," ","Study of a Man","null","1840"
"Frank Duveneck","American","{'artistName': 'Frank Duveneck', 'nationality': 'American', 'artworkTitle': 'Bridge of Sighs, Venice (First Plate)', 'birthPlace': 'Covington, Kentucky', 'medium': 'Etching, printed with plate tone', 'creditLine': 'Harris Brisbane Dick Fund, 1923', 'accessionNumber': '23.44.6', 'dateOfStartOfCreation': '1883', 'deathDate': '1919', 'provenance': 'MetDoesntKnow', 'dimensions': 'sheet: 16 5 8 x 12 1 16 in. (42.2 x 30.7 cm) plate: 10 7 8 x 8 11 16 in. (27.7 x 22 cm) image: 10 9 16 x 8 3 8 in. (26.9 x 21.3 cm)', 'classification': 'Prints', 'dateOfEndOfCreation': '1883', 'deathPlace': 'Cincinnati Ohio', 'birthDate': '1848'}","Covington, Kentucky","Oil on canvas","66.19","Gift of the Charles F. Williams family, 1966","1919","1873","MetDoesntKnow","42 3 4 x 32 1 4 in. (108.6 x 81.9 cm)","Cincinnati Ohio","Paintings"," ","Lady with Fan","1873","1848"
"Thomas Wilmer Dewing","MetDoesntKnow","{'artistName': 'Thomas Wilmer Dewing', 'nationality': 'MetDoesntKnow', 'artworkTitle': 'Green and Gold', 'birthPlace': 'MetDoesntKnow', 'medium': 'Oil on canvas', 'creditLine': 'Gift of Elisabeth Ball, 1953', 'accessionNumber': '53.69', 'dateOfStartOfCreation': 'by1917', 'deathDate': '1938', 'provenance': 'MetDoesntKnow', 'dimensions': '24 1 8 x 22 1 4 in. (61.3 x 56.5 cm)', 'classification': 'Paintings', 'dateOfEndOfCreation': 'by1917', 'deathPlace': 'MetDoesntKnow', 'birthDate': '1851'}","MetDoesntKnow","Oil on canvas","19.171.1","Gift of Edward D. Adams, 1919","1938","1887","MetDoesntKnow","24 1 8 x 40 1 8 in. (61.3 x 101.9 cm)","MetDoesntKnow","Paintings"," ","Tobias and the Angel","1887","1851"
"Peggy Bacon","American","{'artistName': 'Peggy Bacon', 'nationality': 'American', 'artworkTitle': 'The Great Question', 'birthPlace': 'Ridgefield, Connecticut', 'medium': 'Pastel on paper', 'creditLine': 'George A. Hearn Fund, 1939', 'accessionNumber': '39.99.4', 'dateOfStartOfCreation': '1937', 'deathDate': '1987', 'provenance': 'MetDoesntKnow', 'dimensions': 'H. 19-3 4, W. 25-5 8 inches (50.2 x 65.1 cm.)', 'classification': 'Drawings', 'dateOfEndOfCreation': '1937', 'deathPlace': 'Cape Porpoise Maine', 'birthDate': '1895'}","Ridgefield, Connecticut","Ink, watercolor, and gouache on paper","56.76","Arthur Hoppock Hearn Fund, 1956","1987","1954","MetDoesntKnow","H. 20-5 8, W. 29-1 4 inches (52.4 x 74.3 cm.)","Cape Porpoise Maine","Drawings"," ","Lingering Memories","1954","1895"
"Robert Field","MetDoesntKnow","{'artistName': 'Robert Field', 'nationality': 'MetDoesntKnow', 'artworkTitle': 'Robert Stuart', 'birthPlace': 'MetDoesntKnow', 'medium': 'Watercolor on ivory in gold locket with embossed metal foil under a cobalt blue rim; hair reserve verso', 'creditLine': 'Fletcher Fund, 1939', 'accessionNumber': '39.141', 'dateOfStartOfCreation': '1804', 'deathDate': '1819', 'provenance': 'MetDoesntKnow', 'dimensions': '2 7 8 x 2 5 16 in. (7.3 x 5.9 cm)', 'classification': 'Paintings', 'dateOfEndOfCreation': '1804', 'deathPlace': 'American born England Gloucestershire   Kingston Jamaica', 'birthDate': '1769 '}","MetDoesntKnow","Watercolor on ivory","24.109.91","Bequest of Charles Allen Munn, 1924","1819","1804","MetDoesntKnow","3 1 2 x 2 3 4 in. (8.9 x 7 cm)","American born England Gloucestershire   Kingston Jamaica","Paintings"," ","Robert Gilmor","1804","1769 "
"Willem de Kooning","MetDoesntKnow","{'artistName': 'Willem de Kooning', 'nationality': 'MetDoesntKnow', 'artworkTitle': 'Easter Monday', 'birthPlace': 'MetDoesntKnow', 'medium': 'Oil and newspaper transfer on canvas', 'creditLine': 'Rogers Fund, 1956', 'accessionNumber': '56.205.2', 'dateOfStartOfCreation': '1955', 'deathDate': '1997', 'provenance': 'MetDoesntKnow', 'dimensions': '96 x 74in. (243.8 x 188cm) 99 1 4 x 76 1 4 x 3 3 8 in. (252.1 x 193.7 x 8.6 cm) (Frame)', 'classification': 'Paintings', 'dateOfEndOfCreation': '1956', 'deathPlace': 'American born The Netherlands Rotterdam  East Hampton New York', 'birthDate': '1904'}","MetDoesntKnow","Oil on canvas","1984.613.1","From the Collection of Thomas B. Hess, Gift of the heirs of Thomas B. Hess, 1984","1997","1940","MetDoesntKnow","H. 54, W. 44 inches (137.2 x 111.8 cm.)","American born The Netherlands Rotterdam  East Hampton New York","Paintings"," ","The Glazier","1940","1904"
"William Merritt Chase","American","{'artistName': 'William Merritt Chase', 'nationality': 'American', 'artworkTitle': 'Edward Guthrie Kennedy', 'birthPlace': 'Williamsburg, Indiana', 'medium': 'Oil on canvas', 'creditLine': 'Gift of Margaret and Raymond J. Horowitz, 1973', 'accessionNumber': '1973.342', 'dateOfStartOfCreation': '1895 ', 'deathDate': '1916', 'provenance': 'MetDoesntKnow', 'dimensions': '22 x 17 7 8 in. (55.9 x 45.4 cm)', 'classification': 'Paintings', 'dateOfEndOfCreation': '1895 ', 'deathPlace': 'New York', 'birthDate': '1849'}","Williamsburg, Indiana","Oil on canvas","91.11","Gift of William Merritt Chase, 1891","1916","1888","MetDoesntKnow","74 1 4 x 36 5 16 in. (188.6 x 92.2 cm)","New York","Paintings"," ","Lady in Black","1888","1849"
"Matthew Pratt","MetDoesntKnow","{'artistName': 'Matthew Pratt', 'nationality': 'MetDoesntKnow', 'artworkTitle': 'Christiana Stille Keen', 'birthPlace': 'MetDoesntKnow', 'medium': 'Oil on canvas', 'creditLine': 'Purchase, Maria Jesup Fund, 2008', 'accessionNumber': '2008.243', 'dateOfStartOfCreation': '1769 ', 'deathDate': '1805', 'provenance': 'Descended in the family of the sitter until 2007; at Northeast Auctions, August 3-5, 2007, lot 1700; sold to Christopher Rebollo, the vendor', 'dimensions': 'Sight: 30 x 25 in. (76.2 x 63.5 cm)', 'classification': 'Paintings', 'dateOfEndOfCreation': '1769 ', 'deathPlace': 'MetDoesntKnow', 'birthDate': '1734'}","MetDoesntKnow","Oil on canvas","97.29.3","Gift of Samuel P. Avery, 1897","1805","1765","MetDoesntKnow","36 x 50 1 4 in. (91.4 x 127.6 cm)","MetDoesntKnow","Paintings"," ","The American School","1765","1734"
"Frederick Wilson 1858-1932","MetDoesntKnow","{'artistName': 'Frederick Wilson 1858-1932', 'nationality': 'MetDoesntKnow', 'artworkTitle':  Cartoon for window, Wycliffe, St. John's Chapel Episcopal Divinity School, Cambridge, MA , 'birthPlace': 'MetDoesntKnow', 'medium': 'Watercolor, gouache, graphite, and powdered charcoal for pouncing', 'creditLine': 'Purchase, Walter Hoving and Julia T. Weld Gifts and Dodge Fund, 1967', 'accessionNumber': '67.654.300', 'dateOfStartOfCreation': '1912', 'deathDate': '1932', 'provenance': 'MetDoesntKnow', 'dimensions': '34 9 16 x 20 1 4 in. (87.8 x 51.5 cm)', 'classification': 'Drawings', 'dateOfEndOfCreation': '1912', 'deathPlace': 'Frederick Wilson -', 'birthDate': '1858'}","MetDoesntKnow","Watercolor and gouache on paper mounted on original matt board","67.654.73","Purchase, Walter Hoving and Julia T. Weld Gifts and Dodge Fund, 1967","1932","1908 ","MetDoesntKnow","Overall: 10 1 4 x 12 1 4 in. (26 x 31.1 cm) Design, each lancet: 7 5 8 x 3 3 4 in. (19.4 x 9.5 cm)","Frederick Wilson -","Drawings"," ","Design for double window","1908 ","1858"
"Charles Cromwell Ingham","MetDoesntKnow","{'artistName': 'Charles Cromwell Ingham', 'nationality': 'MetDoesntKnow', 'artworkTitle': 'Little Girl with Flowers (Amelia Palmer)', 'birthPlace': 'MetDoesntKnow', 'medium': 'Oil on canvas', 'creditLine': 'Gift of Courtlandt Palmer, 1950', 'accessionNumber': '50.220.1', 'dateOfStartOfCreation': '1830 ', 'deathDate': '1863', 'provenance': 'Amos Palmer, New York, died 1854; probably his wife, Sarah Palmer; her brother-in-law, Courtlandt Palmer, died 1870; his grandson Courtlandt Palmer, until 1950', 'dimensions': '67 7 8 x 53 1 4 in. (172.4 x 135.3 cm)', 'classification': 'Paintings', 'dateOfEndOfCreation': '1830 ', 'deathPlace': 'American born Ireland Dublin  New York', 'birthDate': '1786'}","MetDoesntKnow","Oil on canvas, laid down on composition board","1977.342.2","Bequest of Frederick Sturges Jr., 1977","1863","1835 ","descended to the subject's greatgrandson, Frederick Sturges Jr., Fairfield, Connecticut, until died 1977","30 1 8 x 25 in. (76.5 x 63.5 cm)","American born Ireland Dublin  New York","Paintings"," ","Mrs. Luman Reed","1835 ","1786"
"Lydia Field Emmet","American","{'artistName': 'Victor David Brenner', 'nationality': 'MetDoesntKnow', 'artworkTitle': 'The Cullum Geographical Medal', 'birthPlace': 'MetDoesntKnow', 'medium': 'Silver', 'creditLine': 'Gift of the artist, 1898', 'accessionNumber': '98.10.4', 'dateOfStartOfCreation': 'null', 'deathDate': '1924', 'provenance': 'MetDoesntKnow', 'dimensions': 'Diam. 2 1 2 in. (6.4 cm)', 'classification': 'Sculpture', 'dateOfEndOfCreation': 'null', 'deathPlace': 'American born Lithuania Kaunas  New York', 'birthDate': '1871'}","New Rochelle, New York","Graphite, ink wash, and gouache on wove paper, mounted on cardboard","1997.336","Purchase, Barrie A. and Deedee Wigmore Foundation Gift, 1997","1952","1891","MetDoesntKnow","7 1 2 x 10 1 4 in. (19.1 x 26 cm)","MetDoesntKnow","Drawings"," ","Mistress Mary Quite Contrary","1891","1866"
"Winslow Homer","American","{'artistName': 'Winslow Homer', 'nationality': 'American', 'artworkTitle': 'Eagle Head, Manchester, Massachusetts (High Tide)', 'birthPlace': 'Boston, Massachusetts', 'medium': 'Oil on canvas', 'creditLine': 'Gift of Mrs. William F. Milton, 1923', 'accessionNumber': '23.77.2', 'dateOfStartOfCreation': '1870', 'deathDate': '1910', 'provenance': 'MetDoesntKnow', 'dimensions': '26 x 38 in. (66 x 96.5 cm)', 'classification': 'Paintings', 'dateOfEndOfCreation': '1870', 'deathPlace': 'Prouts Neck Maine', 'birthDate': '1836'}","Boston, Massachusetts","Oil on canvas","22.207","Gift of Mrs. Frank B. Porter, 1922","1910","1866","MetDoesntKnow","24 x 38in. (61 x 96.5cm) Framed: 36 1 2  50 5 8  4 1 2 in. (92.7  128.6  11.4 cm)","Prouts Neck Maine","Paintings"," ","Prisoners from the Front","1866","1836"
"Jack Beal","American","{'artistName': 'Jack Beal', 'nationality': 'American', 'artworkTitle': 'Susan at Black Lake', 'birthPlace': 'born', 'medium': 'Oil on canvas', 'creditLine': 'Gift of Dr. Wesley Halpert and Carolyn M. Halpert, 1987', 'accessionNumber': '1987.365', 'dateOfStartOfCreation': '1969', 'deathDate': 'MetDoesntKnow', 'provenance': 'MetDoesntKnow', 'dimensions': 'H. 48, W. 48 inches (121.9 x 121.9 cm)', 'classification': 'Paintings', 'dateOfEndOfCreation': '1969', 'deathPlace': 'MetDoesntKnow', 'birthDate': '1931'}","born","Oil on canvas","1995.546.1","Gift of Dr. Wesley and Carolyn Halpert, 1995","MetDoesntKnow","1963 ","MetDoesntKnow","H. 59-1 4, W. 58 inches (151.1 x 147.3 cm.)","MetDoesntKnow","Paintings"," ","Study for Dana","1963 ","1931"
"John La Farge","American","{'artistName': 'John La Farge', 'nationality': 'American', 'artworkTitle': 'Wild Roses and Irises', 'birthPlace': 'New York', 'medium': 'Gouache and watercolor on white wove paper', 'creditLine': 'Gift of Priscilla A. B. Henderson, in memory of her grandfather, Russell Sturgis, a founder of The Metropolitan Museum of Art, 1950', 'accessionNumber': '50.113.3', 'dateOfStartOfCreation': '1887', 'deathDate': '1910', 'provenance': 'MetDoesntKnow', 'dimensions': '14 1 2 x 10 7 16 in. (36.8 x 26.5 cm)', 'classification': 'Drawings', 'dateOfEndOfCreation': '1887', 'deathPlace': 'Providence Rhode Island', 'birthDate': '1835'}","New York","Watercolor and gouache on off-white wove paper laid down on off-white wove paper.","53.190","Gift of Alice Thorp, 1953","1910","1896","MetDoesntKnow","6 3 16 x 8 7 16 in. (15.7 x 21.4 cm)","Providence Rhode Island","Drawings"," ","Sheep Porcupine Island, Bar Harbor, Maine, Evening Study, August 29, 1896","1896","1835"
"Robert Goodnough","American","{'artistName': 'Robert Goodnough', 'nationality': 'American', 'artworkTitle': 'Secondary Blocks', 'birthPlace': 'Cortland, New York', 'medium': 'Gouache on paper', 'creditLine': 'Anonymous Gift, 1978', 'accessionNumber': '1978.567.2', 'dateOfStartOfCreation': '1965', 'deathDate': '2010', 'provenance': 'MetDoesntKnow', 'dimensions': 'H. 21-1 4, W. 3-1 2 inches (33.3 x 8.9 cm.)', 'classification': 'Drawings', 'dateOfEndOfCreation': '1965', 'deathPlace': 'White Plains New York', 'birthDate': '1917'}","Cortland, New York","Oil on paper","1978.453","Gift of the artist, 1978","2010","1947","MetDoesntKnow","H. 20-1 8, W. 17-7 8 inches (51.1 x 43.2 cm.)","White Plains New York","Drawings"," ","Untitled","1947","1917"
"After Gilbert Stuart","American","{'artistName': 'Robert Loftin Newman', 'nationality': 'MetDoesntKnow', 'artworkTitle': 'Madonna and Child and Little Saint John', 'birthPlace': 'MetDoesntKnow', 'medium': 'Oil on canvas', 'creditLine': 'Gift of Mrs. Wallace Sawyer, 1921', 'accessionNumber': '21.159.2', 'dateOfStartOfCreation': 'by1894', 'deathDate': '1912', 'provenance': 'MetDoesntKnow', 'dimensions': '10 1 8 x 12 1 8 in. (25.7 x 30.8 cm)', 'classification': 'Paintings', 'dateOfEndOfCreation': 'by1894', 'deathPlace': 'MetDoesntKnow', 'birthDate': '1827'}","North Kingston, Rhode Island","Painted glass","83.2.107","Gift of William H. Huntington, 1883","1828","1776","MetDoesntKnow","8 x 5 3 8 in. (20.3 x 13.7 cm)","Boston Massachusetts","Paintings"," ","Plaque of George Washington","1830","1755"
"David Bates","American","{'artistName': 'David Bates', 'nationality': 'American', 'artworkTitle': 'The Long Cypress', 'birthPlace': 'born Dallas, Texas', 'medium': 'Oil on canvas', 'creditLine': 'Purchase, Anonymous Gift, 1984', 'accessionNumber': '1984.12', 'dateOfStartOfCreation': '1983', 'deathDate': 'MetDoesntKnow', 'provenance': 'MetDoesntKnow', 'dimensions': 'H. 90, W. 72-3 4 inches (228.6 x 184.8 cm.)', 'classification': 'Paintings', 'dateOfEndOfCreation': '1983', 'deathPlace': 'MetDoesntKnow', 'birthDate': '1952'}","born Dallas, Texas","Oil on canvas","1986.71","Purchase, Mrs. Jan Cowles, Virginia Cowles Kurtis and Charles Cowles Gifts, in memory of Gardner Cowles, 1986","MetDoesntKnow","1985","MetDoesntKnow","H. 96, W. 78 inches (243.8 x 198.1 cm.)","MetDoesntKnow","Paintings"," ","The Conservatory","1985","1952"
"James Peale","American","{'artistName': 'James Peale', 'nationality': 'American', 'artworkTitle': 'Still Life: Balsam Apple and Vegetables', 'birthPlace': 'Chestertown, Maryland', 'medium': 'Oil on canvas', 'creditLine': 'Maria DeWitt Jesup Fund, 1939', 'accessionNumber': '39.52', 'dateOfStartOfCreation': '1820s ', 'deathDate': '1831', 'provenance': 'MetDoesntKnow', 'dimensions': '20 1 4 x 26 1 2 in. (51.4 x 67.3 cm)', 'classification': 'Paintings', 'dateOfEndOfCreation': '1820s ', 'deathPlace': 'Philadelphia Pennsylvania', 'birthDate': '1749'}","Chestertown, Maryland","Oil on canvas","1972.191","Gift of Mr. and Mrs. William L. McKim, 1972","1831","1814","MetDoesntKnow","28 1 2 x 24 in. (72.3 x 61 cm)","Philadelphia Pennsylvania","Paintings"," ","Martha Stewart Wilson","1814","1749"
